{
  "schemaVersion": 3,
  "format": "embeddedknowledge-lesson-v1",
  "id": "PREM-SCI-005",
  "version": "0.2.1",
  "status": "published",
  "riskTier": "rephrasing",
  "title": "Sampling, randomization, and blinding: what a study's number is about",
  "language": "en",
  "outcomes": [
    "topic-scientific-inquiry-sampling-randomization"
  ],
  "prerequisites": [
    "topic-scientific-inquiry-study-designs"
  ],
  "objectives": [
    {
      "id": "objective-trace-selection",
      "statement": "Explain what a study's eligibility and recruitment route establishes about the population its estimate describes, and why a route applied before allocation bounds external validity without damaging the comparison between arms.",
      "outcomeIds": [
        "topic-scientific-inquiry-sampling-randomization"
      ]
    },
    {
      "id": "objective-explain-allocation",
      "statement": "Explain how prespecified chance-based random allocation makes compared groups comparable in expectation, distinguish simple, restricted, and stratified randomization from predictable deterministic schemes, and state what randomization does not guarantee in a single study.",
      "outcomeIds": [
        "topic-scientific-inquiry-sampling-randomization"
      ]
    },
    {
      "id": "objective-distinguish-concealment-blinding",
      "statement": "Distinguish allocation concealment from blinding by the moment each acts and the error each prevents, and identify which safeguard a described procedure broke.",
      "outcomeIds": [
        "topic-scientific-inquiry-sampling-randomization"
      ]
    },
    {
      "id": "objective-audit-inference",
      "statement": "Audit an unfamiliar described study across entry, allocation, foreknowledge, and awareness, then state the strongest warranted inference and one material boundary on it.",
      "outcomeIds": [
        "topic-scientific-inquiry-sampling-randomization"
      ]
    }
  ],
  "estimatedMinutes": 92,
  "scenes": [
    {
      "id": "scene-two-chains",
      "title": "What a study's number is actually about",
      "kind": "concept",
      "source": "content/01-two-chains.md",
      "estimatedMinutes": 20,
      "required": true,
      "claimCoverage": "claims-mapped"
    },
    {
      "id": "scene-worked-audit",
      "title": "Auditing a study in time order",
      "kind": "worked-example",
      "source": "content/02-worked-audit.md",
      "estimatedMinutes": 12,
      "required": true,
      "claimCoverage": "claims-mapped"
    },
    {
      "id": "scene-safeguard-timing",
      "title": "Two safeguards divided by one allocation event",
      "kind": "misconception",
      "source": "content/03-same-word-different-moment.md",
      "estimatedMinutes": 14,
      "required": true,
      "claimCoverage": "claims-mapped"
    },
    {
      "id": "scene-practice",
      "title": "Four questions, less and less help",
      "kind": "practice",
      "source": "content/04-practice.md",
      "estimatedMinutes": 22,
      "required": true,
      "claimCoverage": "claims-mapped"
    },
    {
      "id": "scene-transfer-synthesis",
      "title": "Taking the four questions somewhere else",
      "kind": "transfer",
      "source": "content/05-transfer-synthesis.md",
      "estimatedMinutes": 18,
      "required": true,
      "claimCoverage": "claims-mapped"
    },
    {
      "id": "scene-clinical-wrap-up",
      "title": "Clinical wrap-up: audit the diabetes crossover study",
      "kind": "synthesis",
      "source": "content/06-clinical-wrap-up.md",
      "estimatedMinutes": 6,
      "required": true,
      "claimCoverage": "claims-mapped"
    }
  ],
  "authors": [
    {
      "principalId": "github:VSBDev",
      "displayName": "VSBDev \u2014 accountable author, clinical-framing revision",
      "agent": {
        "system": "OpenAI Codex",
        "provider": "OpenAI",
        "model": "gpt-5.6-sol",
        "version": "codex-cli 0.144.6",
        "runId": "codex-reauthor-PREM-SCI-005-7C3F8C4D-1B1D-4B76-9890-DCDCEED50343",
        "instructionsDigest": "sha256:1d72aa5e190cac142bc1a2b28fc9c0a57c005fd0131cd56a6bf6718013b6cd3e"
      }
    }
  ],
  "license": "CC-BY-4.0",
  "files": {
    "assessment": "assessment.json",
    "references": "references.json",
    "claims": "claims.json",
    "glossary": "glossary.json",
    "attribution": "ATTRIBUTION.md"
  },
  "sourceConfidence": "medium-high",
  "aiAssistance": {
    "used": true,
    "disclosure": "VSBDev (github:VSBDev) is accountable for this clinical-framing revision. Material authoring assistance used system RUNTIME-STAMPED, provider RUNTIME-STAMPED, model RUNTIME-STAMPED, version RUNTIME-STAMPED, in isolated run codex-reauthor-PREM-SCI-005-7C3F8C4D-1B1D-4B76-9890-DCDCEED50343. The instructions digest covers the exact discloseable UTF-8 lesson-revision task payload supplied by the user, including its terminal newline; it excludes hidden provider and system instructions."
  },
  "thirdPartyAssets": []
}
