{
  "schemaVersion": 3,
  "format": "embeddedknowledge-lesson-v1",
  "id": "PREM-QNT-007",
  "version": "0.2.0",
  "status": "draft",
  "riskTier": "standard",
  "title": "Read the rule, audit the graph",
  "language": "en",
  "outcomes": [
    "topic-quantitative-foundations-functions-graphs"
  ],
  "prerequisites": [
    "topic-quantitative-foundations-algebra-equations"
  ],
  "objectives": [
    {
      "id": "objective-interpret-function",
      "statement": "Interpret function notation as an input-output rule and determine domain, range, values, and compositions.",
      "outcomeIds": [
        "topic-quantitative-foundations-functions-graphs"
      ]
    },
    {
      "id": "objective-read-graph",
      "statement": "Read coordinates, intercepts, extrema, intervals, and axis scales from graph descriptions and equivalent value tables.",
      "outcomeIds": [
        "topic-quantitative-foundations-functions-graphs"
      ]
    },
    {
      "id": "objective-rate-change",
      "statement": "Calculate and interpret average rate of change as output change divided by input change with units.",
      "outcomeIds": [
        "topic-quantitative-foundations-functions-graphs"
      ]
    },
    {
      "id": "objective-transform-function",
      "statement": "Predict and verify translations, reflections, and stretches by tracking key inputs and outputs.",
      "outcomeIds": [
        "topic-quantitative-foundations-functions-graphs"
      ]
    }
  ],
  "estimatedMinutes": 250,
  "scenes": [
    {
      "id": "scene-orientation",
      "title": "The endpoint is not the change",
      "kind": "orientation",
      "source": "content/010-orientation.md",
      "estimatedMinutes": 25,
      "required": true,
      "claimCoverage": "claims-mapped"
    },
    {
      "id": "scene-concept",
      "title": "A graph is a set of input-output claims",
      "kind": "concept",
      "source": "content/020-concept.md",
      "estimatedMinutes": 45,
      "required": true,
      "claimCoverage": "claims-mapped"
    },
    {
      "id": "scene-worked-example",
      "title": "Transform a parent rule and verify key points",
      "kind": "worked-example",
      "source": "content/030-worked-example.md",
      "estimatedMinutes": 40,
      "required": true,
      "claimCoverage": "claims-mapped"
    },
    {
      "id": "scene-misconception",
      "title": "Inside changes run opposite to the sign",
      "kind": "misconception",
      "source": "content/040-misconception.md",
      "estimatedMinutes": 30,
      "required": true,
      "claimCoverage": "claims-mapped"
    },
    {
      "id": "scene-practice",
      "title": "Move among rule, table, and graph language",
      "kind": "practice",
      "source": "content/050-practice.md",
      "estimatedMinutes": 40,
      "required": true,
      "claimCoverage": "claims-mapped"
    },
    {
      "id": "scene-transfer",
      "title": "Audit a transformed square-root rule",
      "kind": "transfer",
      "source": "content/060-transfer.md",
      "estimatedMinutes": 35,
      "required": true,
      "claimCoverage": "claims-mapped"
    },
    {
      "id": "scene-synthesis",
      "title": "Rebuild the graph audit",
      "kind": "synthesis",
      "source": "content/070-synthesis.md",
      "estimatedMinutes": 25,
      "required": true,
      "claimCoverage": "claims-mapped"
    },
    {
      "id": "scene-clinical-wrap-up",
      "title": "Clinical wrap-up: read a drug's concentration\u2013time curve",
      "kind": "transfer",
      "source": "content/080-clinical-wrap-up.md",
      "estimatedMinutes": 10,
      "required": true,
      "claimCoverage": "claims-mapped"
    }
  ],
  "authors": [
    {
      "principalId": "github:VSBDev",
      "displayName": "VSBDev \u2014 accountable author, clinical-framing revision",
      "agent": {
        "system": "OpenAI Codex",
        "provider": "OpenAI",
        "model": "gpt-5.6-sol",
        "version": "codex-cli 0.144.6",
        "runId": "codex-reauthor-PREM-QNT-007-9E1CC2CE-EFE2-40B6-99FB-23053CBD3BB9",
        "instructionsDigest": "sha256:5fc488cf4f83e4d417daa8c1da30d77773a247938568cf05291dbfd522b4b82f"
      }
    }
  ],
  "license": "CC-BY-4.0",
  "files": {
    "assessment": "assessment.json",
    "references": "references.json",
    "claims": "claims.json",
    "glossary": "glossary.json",
    "attribution": "ATTRIBUTION.md"
  },
  "sourceConfidence": "pending-review",
  "aiAssistance": {
    "used": true,
    "disclosure": "VSBDev (github:VSBDev) is accountable for this clinical-framing revision. Material authoring assistance used system RUNTIME-STAMPED, provider RUNTIME-STAMPED, model RUNTIME-STAMPED, version RUNTIME-STAMPED, in isolated run codex-reauthor-PREM-QNT-007-9E1CC2CE-EFE2-40B6-99FB-23053CBD3BB9. The instructions digest covers the exact discloseable UTF-8 lesson-revision task payload supplied by the user, including its terminal newline; it excludes hidden provider and system instructions."
  },
  "thirdPartyAssets": []
}
