{
  "schemaVersion": 3,
  "format": "embeddedknowledge-lesson-v1",
  "id": "PREM-STA-002",
  "version": "0.1.0",
  "status": "draft",
  "riskTier": "standard",
  "title": "Look before you summarise: tables and graphical displays",
  "language": "en",
  "outcomes": [
    "topic-statistics-data-graphs-tables"
  ],
  "prerequisites": [
    "topic-statistics-data-data-types",
    "topic-quantitative-foundations-functions-graphs"
  ],
  "objectives": [
    {
      "id": "objective-select-a-display",
      "statement": "Select a display for a stated question by naming how many variables it involves, what kind each variable is, and whether the reader needs exact values or a pattern, and justify the choice against at least one rejected alternative.",
      "outcomeIds": [
        "topic-statistics-data-graphs-tables"
      ]
    },
    {
      "id": "objective-read-a-distribution",
      "statement": "Read a histogram of one quantitative variable to report the number of modes, the location of the centre, the spread, the direction of any lean, and any candidate outliers, and state which of those features a single summary value does not carry.",
      "outcomeIds": [
        "topic-statistics-data-graphs-tables"
      ]
    },
    {
      "id": "objective-read-an-association",
      "statement": "Read a scatter plot of two quantitative measurements to describe the direction, form, and strength of the pattern and to identify unusual points, and state what the plot leaves undetermined.",
      "outcomeIds": [
        "topic-statistics-data-graphs-tables"
      ]
    },
    {
      "id": "objective-audit-axes-and-bins",
      "statement": "Diagnose how a truncated numerical axis or a chosen bin width has changed the impression a chart gives, quantify the distortion where the values are available, and state the repair.",
      "outcomeIds": [
        "topic-statistics-data-graphs-tables"
      ]
    }
  ],
  "estimatedMinutes": 180,
  "scenes": [
    {
      "id": "scene-sixty-rows",
      "title": "Sixty rows, and nothing summarised yet",
      "kind": "orientation",
      "source": "content/010-sixty-rows.md",
      "estimatedMinutes": 14,
      "required": true,
      "claimCoverage": "claims-mapped"
    },
    {
      "id": "scene-display-follows-variable",
      "title": "The display follows the variable and the question",
      "kind": "concept",
      "source": "content/020-display-follows-the-variable.md",
      "estimatedMinutes": 28,
      "required": true,
      "claimCoverage": "claims-mapped"
    },
    {
      "id": "scene-read-the-histogram",
      "title": "Reading the histogram that 142 was standing in front of",
      "kind": "worked-example",
      "source": "content/030-read-the-histogram.md",
      "estimatedMinutes": 26,
      "required": true,
      "claimCoverage": "claims-mapped"
    },
    {
      "id": "scene-two-measurements",
      "title": "Two measurements from the same person, one plot",
      "kind": "investigation",
      "source": "content/040-two-measurements-one-plot.md",
      "estimatedMinutes": 24,
      "required": true,
      "claimCoverage": "claims-mapped"
    },
    {
      "id": "scene-two-pictures",
      "title": "One dataset, two pictures, opposite verdicts",
      "kind": "misconception",
      "source": "content/050-two-pictures-one-dataset.md",
      "estimatedMinutes": 24,
      "required": true,
      "claimCoverage": "claims-mapped"
    },
    {
      "id": "scene-choose-and-critique",
      "title": "Choose it, draw it, break it",
      "kind": "practice",
      "source": "content/060-choose-and-critique.md",
      "estimatedMinutes": 26,
      "required": true,
      "claimCoverage": "claims-mapped"
    },
    {
      "id": "scene-one-persons-record",
      "title": "Transfer: ninety mornings belonging to one person",
      "kind": "transfer",
      "source": "content/070-one-persons-record.md",
      "estimatedMinutes": 20,
      "required": true,
      "claimCoverage": "claims-mapped"
    },
    {
      "id": "scene-clinic-morning",
      "title": "Clinical wrap-up: the question a mean of 142 cannot answer",
      "kind": "synthesis",
      "source": "content/080-clinical-wrap-up.md",
      "estimatedMinutes": 18,
      "required": true,
      "claimCoverage": "claims-mapped"
    }
  ],
  "authors": [
    {
      "principalId": "github:VSBDev",
      "displayName": "VSBDev — accountable author",
      "agent": {
        "system": "RUNTIME-STAMPED",
        "provider": "RUNTIME-STAMPED",
        "model": "RUNTIME-STAMPED",
        "version": "RUNTIME-STAMPED",
        "runId": "author-PREM-STA-002-AA0725D5-9A91-44BC-83AC-5AC3E2687598",
        "instructionsDigest": "sha256:61e55ba9891cf86298e8812a8adabfef691d9b66800f9601596e901ebb7c41cb"
      }
    }
  ],
  "license": "CC-BY-4.0",
  "files": {
    "assessment": "assessment.json",
    "references": "references.json",
    "claims": "claims.json",
    "glossary": "glossary.json",
    "attribution": "ATTRIBUTION.md"
  },
  "sourceConfidence": "pending-review",
  "aiAssistance": {
    "used": true,
    "disclosure": "VSBDev (github:VSBDev) is the accountable principal for this authoring run. Material authoring assistance used system RUNTIME-STAMPED, provider RUNTIME-STAMPED, model RUNTIME-STAMPED, version RUNTIME-STAMPED, in isolated run author-PREM-STA-002-AA0725D5-9A91-44BC-83AC-5AC3E2687598. The instructions digest covers the recorded discloseable UTF-8 authoring-task payload for this run, including its terminal newline; it excludes hidden provider and system instructions that cannot be exported."
  },
  "thirdPartyAssets": []
}
