{
  "schemaVersion": 3,
  "format": "embeddedknowledge-lesson-v1",
  "id": "PREM-LPP-003",
  "version": "0.1.0",
  "status": "draft",
  "riskTier": "standard",
  "title": "Design retrieval and spacing for durable performance",
  "language": "en",
  "outcomes": [
    "topic-orientation-mastery-and-retrieval"
  ],
  "prerequisites": [
    "topic-orientation-diagnostic-baseline"
  ],
  "objectives": [
    {
      "id": "objective-distinguish-evidence",
      "statement": "Distinguish familiarity-producing study activity from retrieval that supplies evidence about durable performance.",
      "outcomeIds": [
        "topic-orientation-mastery-and-retrieval"
      ]
    },
    {
      "id": "objective-design-plan",
      "statement": "Construct and justify a retrieval-and-spacing plan from a diagnostic state, target performance, and retention horizon.",
      "outcomeIds": [
        "topic-orientation-mastery-and-retrieval"
      ]
    },
    {
      "id": "objective-adapt-plan",
      "statement": "Interpret performance across attempts and adapt support, spacing, or task mixture without declaring mastery from one fluent encounter.",
      "outcomeIds": [
        "topic-orientation-mastery-and-retrieval"
      ]
    }
  ],
  "estimatedMinutes": 115,
  "scenes": [
    {
      "id": "scene-orientation",
      "title": "From feeling familiar to performing later",
      "kind": "orientation",
      "source": "content/010-orientation.md",
      "estimatedMinutes": 7,
      "required": true,
      "claimCoverage": "claims-mapped"
    },
    {
      "id": "scene-diagnostic",
      "title": "Activate your diagnostic baseline",
      "kind": "diagnostic",
      "source": "content/020-diagnostic.md",
      "estimatedMinutes": 8,
      "required": true,
      "claimCoverage": "no-material-claims"
    },
    {
      "id": "scene-concept",
      "title": "A design loop for durable performance",
      "kind": "concept",
      "source": "content/030-concept.md",
      "estimatedMinutes": 18,
      "required": true,
      "claimCoverage": "claims-mapped"
    },
    {
      "id": "scene-worked-example",
      "title": "Build a fourteen-day retrieval plan",
      "kind": "worked-example",
      "source": "content/040-worked-example.md",
      "estimatedMinutes": 15,
      "required": true,
      "claimCoverage": "claims-mapped"
    },
    {
      "id": "scene-retrieval-check",
      "title": "Reconstruct the design loop",
      "kind": "retrieval-check",
      "source": "content/050-retrieval-check.md",
      "estimatedMinutes": 8,
      "required": true,
      "claimCoverage": "claims-mapped"
    },
    {
      "id": "scene-misconception",
      "title": "Repair the fluency-equals-mastery model",
      "kind": "misconception",
      "source": "content/060-misconception.md",
      "estimatedMinutes": 10,
      "required": true,
      "claimCoverage": "claims-mapped"
    },
    {
      "id": "scene-practice",
      "title": "Fade support and adapt the plan",
      "kind": "practice",
      "source": "content/070-practice.md",
      "estimatedMinutes": 18,
      "required": true,
      "claimCoverage": "claims-mapped"
    },
    {
      "id": "scene-transfer",
      "title": "Redesign a peer study session",
      "kind": "transfer",
      "source": "content/080-transfer.md",
      "estimatedMinutes": 12,
      "required": true,
      "claimCoverage": "claims-mapped"
    },
    {
      "id": "scene-assessment",
      "title": "Demonstrate plan design and adaptation",
      "kind": "assessment",
      "source": "content/090-assessment.md",
      "estimatedMinutes": 10,
      "required": true,
      "claimCoverage": "claims-mapped"
    },
    {
      "id": "scene-synthesis",
      "title": "Carry the loop into later lessons",
      "kind": "synthesis",
      "source": "content/100-synthesis.md",
      "estimatedMinutes": 9,
      "required": true,
      "claimCoverage": "claims-mapped"
    }
  ],
  "authors": [
    {
      "principalId": "github:VSBDev",
      "displayName": "VSBDev",
      "agent": {
        "system": "Codex CLI",
        "provider": "OpenAI",
        "model": "GPT-5",
        "version": "0.144.6",
        "runId": "/root/author_prem_lpp_003",
        "instructionsDigest": "sha256:ca27adccf1f8c30a8c9c956ea0eec64c6c70c505af6a51e4603f1ad12fed708b"
      }
    }
  ],
  "license": "CC-BY-4.0",
  "files": {
    "assessment": "assessment.json",
    "references": "references.json",
    "claims": "claims.json",
    "glossary": "glossary.json",
    "attribution": "ATTRIBUTION.md"
  },
  "sourceConfidence": "pending-review",
  "aiAssistance": {
    "used": true,
    "disclosure": "This lesson pack was materially authored by Codex CLI 0.144.6 using OpenAI GPT-5 in the isolated author run /root/author_prem_lpp_003 under the accountable principal github:VSBDev. The recorded SHA-256 digest covers the exact discloseable material task instructions supplied to this run before its administrative provenance paragraph; it excludes hidden provider and platform instructions. Independent review and adjudication are not part of this run."
  },
  "thirdPartyAssets": []
}
