{
  "schemaVersion": 3,
  "format": "embeddedknowledge-lesson-v1",
  "id": "PSY-INT-001",
  "version": "0.1.0",
  "status": "published",
  "riskTier": "standard",
  "title": "Six decisions before anyone spoke: setting, role, and consent",
  "language": "en",
  "outcomes": [
    "topic-psy-130-setting-role-consent"
  ],
  "prerequisites": [
    "topic-psy-101-description-and-inference"
  ],
  "objectives": [
    {
      "id": "objective-trace-fact-to-setup",
      "statement": "Trace a named fact in a fictional clinical record back to the specific setup decision that made it available, and state what the record would have contained instead under a stated alternative arrangement.",
      "outcomeIds": [
        "topic-psy-130-setting-role-consent"
      ]
    },
    {
      "id": "objective-treat-consent-as-arrangement",
      "statement": "Distinguish a negotiated and revisable agreement from a recorded permission, state what has to be disclosed for the agreement to mean anything including the limits the person does not control, and identify the point at which such an agreement changed.",
      "outcomeIds": [
        "topic-psy-130-setting-role-consent"
      ]
    },
    {
      "id": "objective-place-the-role-boundary",
      "statement": "Classify who holds which role in a described encounter and decide which acts a person in a non-clinical role may and may not perform, justifying each decision from the act and the person it lands on instead of from the subject matter.",
      "outcomeIds": [
        "topic-psy-130-setting-role-consent"
      ]
    },
    {
      "id": "objective-prepare-a-simulated-encounter",
      "statement": "Prepare an accessible simulated encounter by settling its place and privacy, who is present and on what basis, each person's role and the purpose, the time available, the record and who reads it, and the communication arrangements, and state the resulting agreement and its limits.",
      "outcomeIds": [
        "topic-psy-130-setting-role-consent"
      ]
    }
  ],
  "estimatedMinutes": 95,
  "scenes": [
    {
      "id": "scene-the-sentence-that-was-asked-for",
      "title": "The sentence that is only there because someone asked",
      "kind": "orientation",
      "source": "content/01-the-sentence-that-was-asked-for.md",
      "estimatedMinutes": 13,
      "required": true,
      "claimCoverage": "claims-mapped"
    },
    {
      "id": "scene-six-decisions",
      "title": "Six decisions, made before R. said anything",
      "kind": "concept",
      "source": "content/02-six-decisions-behind-one-conversation.md",
      "estimatedMinutes": 15,
      "required": true,
      "claimCoverage": "claims-mapped"
    },
    {
      "id": "scene-what-r-agreed-to",
      "title": "What R. actually agreed to, and when it changed",
      "kind": "worked-example",
      "source": "content/03-what-r-actually-agreed-to.md",
      "estimatedMinutes": 16,
      "required": true,
      "claimCoverage": "claims-mapped"
    },
    {
      "id": "scene-two-models",
      "title": "Two models of consent that fail quietly",
      "kind": "misconception",
      "source": "content/04-two-models-that-fail-quietly.md",
      "estimatedMinutes": 13,
      "required": true,
      "claimCoverage": "claims-mapped"
    },
    {
      "id": "scene-three-passes",
      "title": "Three passes, with the scaffolding taken away",
      "kind": "practice",
      "source": "content/05-three-passes-and-a-way-back.md",
      "estimatedMinutes": 14,
      "required": true,
      "claimCoverage": "claims-mapped"
    },
    {
      "id": "scene-telephone-transfer",
      "title": "The same six decisions, by telephone",
      "kind": "transfer",
      "source": "content/06-the-same-six-decisions-by-telephone.md",
      "estimatedMinutes": 11,
      "required": true,
      "claimCoverage": "claims-mapped"
    },
    {
      "id": "scene-clinical-wrap-up",
      "title": "Clinical wrap-up: one sentence in a letter to a GP",
      "kind": "synthesis",
      "source": "content/07-clinical-wrap-up-the-letter.md",
      "estimatedMinutes": 13,
      "required": true,
      "claimCoverage": "claims-mapped"
    }
  ],
  "authors": [
    {
      "principalId": "github:VSBDev",
      "displayName": "VSBDev — accountable author",
      "agent": {
        "system": "RUNTIME-STAMPED",
        "provider": "RUNTIME-STAMPED",
        "model": "RUNTIME-STAMPED",
        "version": "RUNTIME-STAMPED",
        "runId": "author-PSY-INT-001-04276125-D462-4124-BF51-297B129DCD7D",
        "instructionsDigest": "sha256:65944bcb3b4ee94ceaff4fb55a9aaab1e7f6ba34a7b0473e9f2aca9d5887b8e0"
      }
    }
  ],
  "license": "CC-BY-4.0",
  "files": {
    "assessment": "assessment.json",
    "references": "references.json",
    "claims": "claims.json",
    "glossary": "glossary.json",
    "attribution": "ATTRIBUTION.md"
  },
  "sourceConfidence": "medium-high",
  "aiAssistance": {
    "used": true,
    "disclosure": "VSBDev (github:VSBDev) is accountable for this authoring candidate. Material agent assistance ran under run ID author-PSY-INT-001-04276125-D462-4124-BF51-297B129DCD7D on 2026-07-25; the agent system, provider, model, and version are recorded as the operator-stamped literal RUNTIME-STAMPED and are stamped by the operator before review. The instruction digest covers the exact disclosed UTF-8 material task payload, including its final newline, and excludes hidden provider and system instructions that cannot be exported."
  },
  "thirdPartyAssets": []
}
