{
  "schemaVersion": 3,
  "format": "embeddedknowledge-lesson-v1",
  "id": "PREM-WEL-001",
  "version": "0.4.4",
  "status": "published",
  "riskTier": "rephrasing",
  "title": "Welcome to Premed",
  "language": "en",
  "outcomes": [
    "topic-welcome-course-journey"
  ],
  "prerequisites": [],
  "objectives": [
    {
      "id": "objective-describe-subject-journey",
      "statement": "Describe the recommended Premed subject journey and explain at least two ways one stage prepares the next.",
      "outcomeIds": [
        "topic-welcome-course-journey"
      ]
    },
    {
      "id": "objective-explain-medical-relevance",
      "statement": "Explain why representative concepts from the Premed subjects matter for later medical study.",
      "outcomeIds": [
        "topic-welcome-course-journey"
      ]
    },
    {
      "id": "objective-identify-completion-capabilities",
      "statement": "Identify the scientific knowledge and concrete capabilities learners should be able to use by course completion.",
      "outcomeIds": [
        "topic-welcome-course-journey"
      ]
    }
  ],
  "estimatedMinutes": 60,
  "scenes": [
    {
      "id": "scene-welcome",
      "title": "Welcome to Premed",
      "kind": "orientation",
      "source": "content/01-welcome.md",
      "estimatedMinutes": 18,
      "required": true,
      "claimCoverage": "claims-mapped"
    },
    {
      "id": "scene-journey",
      "title": "How the subjects prepare you for what follows",
      "kind": "concept",
      "source": "content/02-journey.md",
      "estimatedMinutes": 14,
      "required": true,
      "claimCoverage": "claims-mapped"
    },
    {
      "id": "scene-learning",
      "title": "What learning will look like",
      "kind": "practice",
      "source": "content/03-learning.md",
      "estimatedMinutes": 16,
      "required": true,
      "claimCoverage": "claims-mapped"
    },
    {
      "id": "scene-finish",
      "title": "The destination and your first check",
      "kind": "transfer",
      "source": "content/04-finish.md",
      "estimatedMinutes": 12,
      "required": true,
      "claimCoverage": "claims-mapped"
    }
  ],
  "authors": [
    {
      "principalId": "github:VSBDev",
      "displayName": "VSBDev",
      "agent": {
        "system": "Codex",
        "provider": "OpenAI",
        "model": "GPT-5.6-Sol",
        "version": "Codex CLI 0.144.6",
        "runId": "author-codex-gpt56sol-20260720-0f9f6376-9e64-4002-8ae7-e7bc8759713d",
        "instructionsDigest": "sha256:c2253cdb9007d71ebbfc765124f48a1768049b12ca05c4739b767192661ca8a1"
      }
    }
  ],
  "license": "CC-BY-4.0",
  "files": {
    "assessment": "assessment.json",
    "references": "references.json",
    "claims": "claims.json",
    "glossary": "glossary.json",
    "attribution": "ATTRIBUTION.md"
  },
  "sourceConfidence": "medium-high",
  "aiAssistance": {
    "used": true,
    "disclosure": "VSBDev (github:VSBDev) is accountable. Material authoring and revision assistance used Codex, OpenAI, and Codex CLI 0.144.6. Runs 1-4 used GPT-5.6-Sol; runs 5-7 used gpt-5.6-sol. Each digest covers that run's exact discloseable material instructions and excludes hidden provider/system instructions. Run ID | instructions digest: author-codex-gpt56sol-20260720-0f9f6376-9e64-4002-8ae7-e7bc8759713d | sha256:c2253cdb9007d71ebbfc765124f48a1768049b12ca05c4739b767192661ca8a1; author-revision-codex-gpt56sol-20260720-382e03c4-873b-4a98-bfc4-8f1ed517dd30 | sha256:0d6a90300e58025469c13f7a74729aec7b968c6278e9a763038b1d7988e845cf; author-cohort-revision-codex-gpt56sol-20260720-a139cf25-b158-4785-8712-86c8caba7f4a | sha256:4831444e0fc5307974e07fe4745acd0442e0a94fd5505e3cd52bba971002f041; author-cohort-v020-revision-codex-gpt56sol-20260720-36b557bf-7181-4698-b1d6-205fa2d9e2b3 | sha256:70ba9ca41ba564af24a6836b3381346255988983ef1939802a4d09b7e450b046; 019f7ee5-78ad-7652-bc8b-225426713b6b | sha256:afb9427fd59af49a0f456fe59ce54084b0683187cee3485bfa5c8e4de0fb7ad6; 019f7f09-7b24-7a73-8192-673817361ef5 | sha256:ad6457e3a7e7766b98561ed919fc2b84bc18c8fc7e9aaad060007034eec0aba3; 019f7f22-3f6f-7ee0-bb96-6cb95ff5d215 | sha256:4861e0e2e8f09ac7717aaf9bbda4fe2601e12e82e8911706ff94fe5649e9b2e6."
  },
  "thirdPartyAssets": []
}
