{
  "schemaVersion": 3,
  "format": "embeddedknowledge-lesson-v1",
  "id": "PREM-STA-001",
  "version": "0.1.0",
  "status": "published",
  "riskTier": "standard",
  "title": "Variables and data types: what kind of thing is each column?",
  "language": "en",
  "outcomes": [
    "topic-statistics-data-data-types"
  ],
  "prerequisites": [],
  "objectives": [
    {
      "id": "objective-classify-columns",
      "statement": "Classify each recorded column of a supplied study file as nominal, ordinal, discrete quantitative, or continuous quantitative, and justify the classification from how the values were produced rather than from how they are stored.",
      "outcomeIds": [
        "topic-statistics-data-data-types"
      ]
    },
    {
      "id": "objective-match-summary-to-level",
      "statement": "Select the summaries and displays a column's level of measurement supports, and explain why an unsupported summary reports the coding scheme rather than the people measured.",
      "outcomeIds": [
        "topic-statistics-data-data-types"
      ]
    },
    {
      "id": "objective-read-paired-independent",
      "statement": "Decide from a study description whether two sets of values are paired or independent, and state what that structure settles about the comparison that follows.",
      "outcomeIds": [
        "topic-statistics-data-data-types"
      ]
    }
  ],
  "estimatedMinutes": 88,
  "scenes": [
    {
      "id": "scene-column-kinds",
      "title": "Two averages, one of them meaningless",
      "kind": "concept",
      "source": "content/01-column-kinds.md",
      "estimatedMinutes": 13,
      "required": true,
      "claimCoverage": "claims-mapped"
    },
    {
      "id": "scene-what-the-level-permits",
      "title": "What each level lets you say",
      "kind": "concept",
      "source": "content/02-what-the-level-permits.md",
      "estimatedMinutes": 13,
      "required": true,
      "claimCoverage": "claims-mapped"
    },
    {
      "id": "scene-worked-audit",
      "title": "Audit the file column by column",
      "kind": "worked-example",
      "source": "content/03-worked-audit.md",
      "estimatedMinutes": 15,
      "required": true,
      "claimCoverage": "claims-mapped"
    },
    {
      "id": "scene-mean-of-a-code",
      "title": "The average that moves when nothing moves",
      "kind": "misconception",
      "source": "content/04-mean-of-a-code.md",
      "estimatedMinutes": 12,
      "required": true,
      "claimCoverage": "claims-mapped"
    },
    {
      "id": "scene-practice-fading",
      "title": "Practice on a file you have not seen",
      "kind": "practice",
      "source": "content/05-practice-fading.md",
      "estimatedMinutes": 13,
      "required": true,
      "claimCoverage": "claims-mapped"
    },
    {
      "id": "scene-transfer-triage",
      "title": "Transfer: a quality report that needs rewriting",
      "kind": "transfer",
      "source": "content/06-transfer-triage.md",
      "estimatedMinutes": 12,
      "required": true,
      "claimCoverage": "claims-mapped"
    },
    {
      "id": "scene-clinical-wrap-up",
      "title": "Clinical wrap-up: should the glucose column become a yes or a no?",
      "kind": "transfer",
      "source": "content/07-clinical-wrap-up.md",
      "estimatedMinutes": 10,
      "required": true,
      "claimCoverage": "claims-mapped"
    }
  ],
  "authors": [
    {
      "principalId": "github:VSBDev",
      "displayName": "VSBDev — accountable author",
      "agent": {
        "system": "RUNTIME-STAMPED",
        "provider": "RUNTIME-STAMPED",
        "model": "RUNTIME-STAMPED",
        "version": "RUNTIME-STAMPED",
        "runId": "author-PREM-STA-001-A16D33E3-9D82-49C4-A5AF-6F2ABCFE5665",
        "instructionsDigest": "sha256:a56b0a56109a75f3ccf8a786f738c2320ae6352c4557e4a12c04bce857302edd"
      }
    }
  ],
  "license": "CC-BY-4.0",
  "files": {
    "assessment": "assessment.json",
    "references": "references.json",
    "claims": "claims.json",
    "glossary": "glossary.json",
    "attribution": "ATTRIBUTION.md"
  },
  "sourceConfidence": "medium-high",
  "aiAssistance": {
    "used": true,
    "disclosure": "VSBDev (github:VSBDev) is accountable for this authoring candidate. Material agent assistance ran under run ID author-PREM-STA-001-A16D33E3-9D82-49C4-A5AF-6F2ABCFE5665 on 2026-07-25; the agent system, provider, model, and version are recorded as the operator-stamped literal RUNTIME-STAMPED and are stamped by the operator before review. The instruction digest covers the exact disclosed UTF-8 material task payload, including its final newline, and excludes hidden provider and system instructions that cannot be exported."
  },
  "thirdPartyAssets": []
}
