{
  "schemaVersion": 3,
  "format": "embeddedknowledge-lesson-v1",
  "id": "PREM-STA-005",
  "version": "0.1.0",
  "status": "draft",
  "riskTier": "standard",
  "title": "The curve you draw over the bars",
  "language": "en",
  "outcomes": [
    "topic-statistics-data-distributions"
  ],
  "prerequisites": [
    "topic-statistics-data-probability",
    "topic-statistics-data-center-spread"
  ],
  "objectives": [
    {
      "id": "objective-fit-the-normal-model",
      "statement": "State the two parameters that fix a normal distribution, compute the one, two and three standard deviation bands for a stated mean and standard deviation, and read a probability as an area between two values rather than a height at one.",
      "outcomeIds": [
        "topic-statistics-data-distributions"
      ]
    },
    {
      "id": "objective-check-the-model",
      "statement": "Convert the empirical rule into predicted counts for a stated sample, compare those predictions against observed counts tail by tail, and decide from the comparison whether to retain or reject the normal model.",
      "outcomeIds": [
        "topic-statistics-data-distributions"
      ]
    },
    {
      "id": "objective-standardise-a-reading",
      "statement": "Compute a z-score for a measurement against a named reference distribution, explain why the score is unchanged by a unit conversion, and separate what a z-score reports as a distance from what only a distributional assumption can turn into a probability.",
      "outcomeIds": [
        "topic-statistics-data-distributions"
      ]
    },
    {
      "id": "objective-model-a-count",
      "statement": "Select the binomial model for the number of yes-or-no results in a fixed set of trials, test its four conditions against a described study, and compute the expected count and its standard deviation.",
      "outcomeIds": [
        "topic-statistics-data-distributions"
      ]
    }
  ],
  "estimatedMinutes": 214,
  "scenes": [
    {
      "id": "scene-curve-someone-drew",
      "title": "The curve someone drew over the bars",
      "kind": "orientation",
      "source": "content/01-the-curve-someone-drew.md",
      "estimatedMinutes": 18,
      "required": true,
      "claimCoverage": "claims-mapped"
    },
    {
      "id": "scene-two-numbers-fix-the-curve",
      "title": "Two numbers, and the whole curve is decided",
      "kind": "concept",
      "source": "content/02-two-numbers-fix-the-curve.md",
      "estimatedMinutes": 34,
      "required": true,
      "claimCoverage": "claims-mapped"
    },
    {
      "id": "scene-checking-the-model",
      "title": "Now go and count",
      "kind": "worked-example",
      "source": "content/03-checking-the-model.md",
      "estimatedMinutes": 32,
      "required": true,
      "claimCoverage": "claims-mapped"
    },
    {
      "id": "scene-common-ruler",
      "title": "One ruler for measurements that share no units",
      "kind": "concept",
      "source": "content/04-a-common-ruler.md",
      "estimatedMinutes": 30,
      "required": true,
      "claimCoverage": "claims-mapped"
    },
    {
      "id": "scene-where-the-bell-misleads",
      "title": "The same check, run on a population that fails it",
      "kind": "misconception",
      "source": "content/05-where-the-bell-misleads.md",
      "estimatedMinutes": 30,
      "required": true,
      "claimCoverage": "claims-mapped"
    },
    {
      "id": "scene-counting-yes-or-no",
      "title": "When the question is a count, the curve is the wrong tool",
      "kind": "concept",
      "source": "content/06-counting-yes-or-no.md",
      "estimatedMinutes": 34,
      "required": true,
      "claimCoverage": "claims-mapped"
    },
    {
      "id": "scene-practice-props-removed",
      "title": "Practice, with the props taken away one at a time",
      "kind": "practice",
      "source": "content/07-practice-with-the-props-removed.md",
      "estimatedMinutes": 14,
      "required": true,
      "claimCoverage": "claims-mapped"
    },
    {
      "id": "scene-transfer-length-of-stay",
      "title": "The same method, on a measurement that is not glucose",
      "kind": "transfer",
      "source": "content/08-somewhere-else-entirely.md",
      "estimatedMinutes": 10,
      "required": true,
      "claimCoverage": "claims-mapped"
    },
    {
      "id": "scene-clinical-wrap-up",
      "title": "Clinical wrap-up: planning a clinic from a curve",
      "kind": "synthesis",
      "source": "content/09-clinical-wrap-up.md",
      "estimatedMinutes": 12,
      "required": true,
      "claimCoverage": "claims-mapped"
    }
  ],
  "authors": [
    {
      "principalId": "github:VSBDev",
      "displayName": "VSBDev — accountable author",
      "agent": {
        "system": "RUNTIME-STAMPED",
        "provider": "RUNTIME-STAMPED",
        "model": "RUNTIME-STAMPED",
        "version": "RUNTIME-STAMPED",
        "runId": "claude-author-PREM-STA-005-11d261ab-4095-4ef4-bab7-6cb91260a01e",
        "instructionsDigest": "sha256:7a5c780a37957562da1763942bbaa5c98ae4ee5d15ef7e87b05a2b556d386b4b"
      }
    }
  ],
  "license": "CC-BY-4.0",
  "files": {
    "assessment": "assessment.json",
    "references": "references.json",
    "claims": "claims.json",
    "glossary": "glossary.json",
    "attribution": "ATTRIBUTION.md"
  },
  "sourceConfidence": "pending-review",
  "aiAssistance": {
    "used": true,
    "disclosure": "VSBDev (github:VSBDev) is accountable for this lesson pack. Material authoring assistance used system RUNTIME-STAMPED, provider RUNTIME-STAMPED, model RUNTIME-STAMPED, version RUNTIME-STAMPED, in isolated run claude-author-PREM-STA-005-11d261ab-4095-4ef4-bab7-6cb91260a01e. The instructions digest covers the exact discloseable UTF-8 lesson-authoring task payload supplied to this run, including its terminal newline; it excludes hidden provider and system instructions that cannot be exported."
  },
  "thirdPartyAssets": []
}
