{
  "schemaVersion": 3,
  "format": "embeddedknowledge-lesson-v1",
  "id": "PREM-SCI-007",
  "version": "0.2.0",
  "status": "published",
  "riskTier": "standard",
  "title": "From correlation to a causal claim",
  "language": "en",
  "outcomes": [
    "topic-scientific-inquiry-correlation-causation"
  ],
  "prerequisites": [
    "topic-scientific-inquiry-study-designs"
  ],
  "objectives": [
    {
      "id": "objective-distinguish-inference-targets",
      "statement": "Classify a study conclusion as association, mechanism, bounded causal attribution, or unsupported from the described evidence.",
      "outcomeIds": [
        "topic-scientific-inquiry-correlation-causation"
      ]
    },
    {
      "id": "objective-map-rival-paths",
      "statement": "Use time order and causal arrow maps to distinguish confounders, reverse causation, mediators, and colliders and to judge whether adjustment serves the stated causal question.",
      "outcomeIds": [
        "topic-scientific-inquiry-correlation-causation"
      ]
    },
    {
      "id": "objective-calibrate-causal-attribution",
      "statement": "Justify the strongest warranted claim from a randomized, observational, or natural-experiment comparison while stating its identifying assumptions and a material scope boundary.",
      "outcomeIds": [
        "topic-scientific-inquiry-correlation-causation"
      ]
    }
  ],
  "estimatedMinutes": 74,
  "scenes": [
    {
      "id": "scene-read-the-claim",
      "title": "The same difference can support different claims",
      "kind": "orientation",
      "source": "content/01-read-the-claim.md",
      "estimatedMinutes": 10,
      "required": true,
      "claimCoverage": "claims-mapped"
    },
    {
      "id": "scene-build-causal-map",
      "title": "Ask what the evidence is trying to prove",
      "kind": "concept",
      "source": "content/02-build-the-map.md",
      "estimatedMinutes": 16,
      "required": true,
      "claimCoverage": "claims-mapped"
    },
    {
      "id": "scene-audit-app-study",
      "title": "Audit three evidence packets about one app",
      "kind": "worked-example",
      "source": "content/03-audit-the-app-study.md",
      "estimatedMinutes": 15,
      "required": true,
      "claimCoverage": "claims-mapped"
    },
    {
      "id": "scene-repair-practise",
      "title": "Do not adjust by reflex",
      "kind": "practice",
      "source": "content/04-repair-and-practise.md",
      "estimatedMinutes": 14,
      "required": true,
      "claimCoverage": "claims-mapped"
    },
    {
      "id": "scene-transfer-judgment",
      "title": "Transfer the judgment to a laboratory system",
      "kind": "transfer",
      "source": "content/05-transfer-the-judgment.md",
      "estimatedMinutes": 10,
      "required": true,
      "claimCoverage": "claims-mapped"
    },
    {
      "id": "scene-mastery-spacing",
      "title": "Make the strongest claim the design can carry",
      "kind": "assessment",
      "source": "content/06-mastery-and-spacing.md",
      "estimatedMinutes": 6,
      "required": true,
      "claimCoverage": "claims-mapped"
    },
    {
      "id": "scene-clinical-wrap-up",
      "title": "Clinical wrap-up: test the late-dinner correlation",
      "kind": "synthesis",
      "source": "content/07-clinical-wrap-up.md",
      "estimatedMinutes": 3,
      "required": true,
      "claimCoverage": "claims-mapped"
    }
  ],
  "authors": [
    {
      "principalId": "github:VSBDev",
      "displayName": "VSBDev — accountable author, clinical-framing revision",
      "agent": {
        "system": "OpenAI Codex",
        "provider": "OpenAI",
        "model": "gpt-5.6-sol",
        "version": "codex-cli 0.144.6",
        "runId": "codex-reauthor-PREM-SCI-007-880D55BE-4F97-4E65-9BE4-1C2AFE6A8927",
        "instructionsDigest": "sha256:3c039b344de6498a3d0b30c2c9edf50266c3418b9ebfddf09059e905bb450faa"
      }
    }
  ],
  "license": "CC-BY-4.0",
  "files": {
    "assessment": "assessment.json",
    "references": "references.json",
    "claims": "claims.json",
    "glossary": "glossary.json",
    "attribution": "ATTRIBUTION.md"
  },
  "sourceConfidence": "medium-high",
  "aiAssistance": {
    "used": true,
    "disclosure": "VSBDev (github:VSBDev) is accountable for this clinical-framing revision. Material authoring assistance used system RUNTIME-STAMPED, provider RUNTIME-STAMPED, model RUNTIME-STAMPED, version RUNTIME-STAMPED, in isolated run codex-reauthor-PREM-SCI-007-880D55BE-4F97-4E65-9BE4-1C2AFE6A8927. The instructions digest covers the exact discloseable UTF-8 lesson-revision task payload supplied by the user, including its terminal newline; it excludes hidden provider and system instructions."
  },
  "thirdPartyAssets": []
}
