{
  "schemaVersion": 3,
  "format": "embeddedknowledge-lesson-v1",
  "id": "PREM-SCI-003",
  "version": "0.2.0",
  "status": "draft",
  "riskTier": "standard",
  "title": "Variables and controls: what a comparison really tests",
  "language": "en",
  "outcomes": [
    "topic-scientific-inquiry-variables-controls"
  ],
  "prerequisites": [
    "topic-scientific-inquiry-hypotheses-predictions"
  ],
  "objectives": [
    {
      "id": "objective-identify-variable-roles",
      "statement": "Identify the independent, dependent, and controlled variables in a supplied comparison and explain the job of each.",
      "outcomeIds": [
        "topic-scientific-inquiry-variables-controls"
      ]
    },
    {
      "id": "objective-distinguish-controls-confounders",
      "statement": "Distinguish a controlled variable from a control condition and identify a confounder as a separate rival factor that changes with the independent variable, could affect the dependent variable, and is not a step through which the independent variable produces the response.",
      "outcomeIds": [
        "topic-scientific-inquiry-variables-controls"
      ]
    },
    {
      "id": "objective-interpret-positive-negative-controls",
      "statement": "Identify positive-control and negative-control conditions and use their results to decide whether an unknown result is interpretable.",
      "outcomeIds": [
        "topic-scientific-inquiry-variables-controls"
      ]
    }
  ],
  "estimatedMinutes": 70,
  "scenes": [
    {
      "id": "scene-zero-two-meanings",
      "title": "When nothing happened has two meanings",
      "kind": "concept",
      "source": "content/01-zero-two-meanings.md",
      "estimatedMinutes": 14,
      "required": true,
      "claimCoverage": "claims-mapped"
    },
    {
      "id": "scene-worked-run",
      "title": "Audit one comparison from start to finish",
      "kind": "worked-example",
      "source": "content/02-worked-run.md",
      "estimatedMinutes": 19,
      "required": true,
      "claimCoverage": "claims-mapped"
    },
    {
      "id": "scene-practise-repair",
      "title": "Find the role, then find the flaw",
      "kind": "practice",
      "source": "content/03-practise-repair.md",
      "estimatedMinutes": 18,
      "required": true,
      "claimCoverage": "claims-mapped"
    },
    {
      "id": "scene-transfer-synthesis",
      "title": "Transfer the audit to a field sensor",
      "kind": "transfer",
      "source": "content/04-transfer-synthesis.md",
      "estimatedMinutes": 12,
      "required": true,
      "claimCoverage": "claims-mapped"
    },
    {
      "id": "scene-clinical-wrap-up",
      "title": "Clinical wrap-up: audit the diabetes comparison",
      "kind": "transfer",
      "source": "content/05-clinical-wrap-up.md",
      "estimatedMinutes": 7,
      "required": true,
      "claimCoverage": "no-material-claims"
    }
  ],
  "authors": [
    {
      "principalId": "github:VSBDev",
      "displayName": "VSBDev \u2014 accountable author, clinical-framing revision",
      "agent": {
        "system": "OpenAI Codex",
        "provider": "OpenAI",
        "model": "gpt-5.6-sol",
        "version": "codex-cli 0.144.6",
        "runId": "codex-reauthor-PREM-SCI-003-C7CCE2C7-ECAA-4262-A194-51D314CAFB44",
        "instructionsDigest": "sha256:8e9d702ad1efa029e21d71f0044b81ceeeebd4ace812df7835f97f10f7bdd09b"
      }
    }
  ],
  "license": "CC-BY-4.0",
  "files": {
    "assessment": "assessment.json",
    "references": "references.json",
    "claims": "claims.json",
    "glossary": "glossary.json",
    "attribution": "ATTRIBUTION.md"
  },
  "sourceConfidence": "pending-review",
  "aiAssistance": {
    "used": true,
    "disclosure": "VSBDev (github:VSBDev) is accountable for this clinical-framing revision. Material assistance used the operator-stamped literal RUNTIME-STAMPED for system, provider, model, and version in fresh run codex-reauthor-PREM-SCI-003-C7CCE2C7-ECAA-4262-A194-51D314CAFB44 on 2026-07-25. The instruction digest covers the exact disclosed UTF-8 material task payload, including its final newline, and excludes hidden provider and system instructions."
  },
  "thirdPartyAssets": []
}
