{
  "schemaVersion": 3,
  "format": "embeddedknowledge-lesson-v1",
  "id": "PREM-SCI-010",
  "version": "0.2.0",
  "status": "published",
  "riskTier": "standard",
  "title": "Using scientific models without outrunning their limits",
  "language": "en",
  "outcomes": [
    "topic-scientific-inquiry-models-and-limits"
  ],
  "prerequisites": [
    "topic-scientific-inquiry-hypotheses-predictions"
  ],
  "objectives": [
    {
      "id": "objective-audit-model",
      "statement": "Audit a scientific model by identifying its purpose, output, inputs, parameters, assumptions, scale, and domain.",
      "outcomeIds": [
        "topic-scientific-inquiry-models-and-limits"
      ]
    },
    {
      "id": "objective-use-and-stress",
      "statement": "Use a model to make and check a prediction, then test how a plausible input or assumption change affects the result.",
      "outcomeIds": [
        "topic-scientific-inquiry-models-and-limits"
      ]
    },
    {
      "id": "objective-diagnose-response",
      "statement": "Diagnose a model failure from boundary or comparison evidence and justify whether to restrict, recalibrate, revise, or replace the model.",
      "outcomeIds": [
        "topic-scientific-inquiry-models-and-limits"
      ]
    }
  ],
  "estimatedMinutes": 66,
  "scenes": [
    {
      "id": "scene-precise-answer-wrong-tool",
      "title": "A precise answer from the wrong tool",
      "kind": "orientation",
      "source": "content/01-precise-answer-wrong-tool.md",
      "estimatedMinutes": 9,
      "required": true,
      "claimCoverage": "claims-mapped"
    },
    {
      "id": "scene-model-audit",
      "title": "Four questions before trusting a model",
      "kind": "concept",
      "source": "content/02-four-question-model-audit.md",
      "estimatedMinutes": 13,
      "required": true,
      "claimCoverage": "claims-mapped"
    },
    {
      "id": "scene-worked-pressure",
      "title": "Predict pressure, then test the prediction",
      "kind": "worked-example",
      "source": "content/03-worked-pressure-prediction.md",
      "estimatedMinutes": 13,
      "required": true,
      "claimCoverage": "claims-mapped"
    },
    {
      "id": "scene-stress-and-repair",
      "title": "Make the model show where it breaks",
      "kind": "practice",
      "source": "content/04-stress-test-and-repair.md",
      "estimatedMinutes": 12,
      "required": true,
      "claimCoverage": "claims-mapped"
    },
    {
      "id": "scene-transfer-chamber",
      "title": "Transfer the audit to a larger chamber",
      "kind": "transfer",
      "source": "content/05-transfer-to-new-chamber.md",
      "estimatedMinutes": 9,
      "required": true,
      "claimCoverage": "claims-mapped"
    },
    {
      "id": "scene-mastery-retrieval",
      "title": "Show mastery and schedule the next retrieval",
      "kind": "assessment",
      "source": "content/06-mastery-and-retrieval.md",
      "estimatedMinutes": 6,
      "required": true,
      "claimCoverage": "claims-mapped"
    },
    {
      "id": "scene-clinical-wrap-up",
      "title": "Clinical wrap-up: audit an overnight glucose sketch",
      "kind": "synthesis",
      "source": "content/07-clinical-wrap-up.md",
      "estimatedMinutes": 4,
      "required": true,
      "claimCoverage": "no-material-claims"
    }
  ],
  "authors": [
    {
      "principalId": "github:VSBDev",
      "displayName": "VSBDev — accountable author, clinical-framing revision",
      "agent": {
        "system": "OpenAI Codex",
        "provider": "OpenAI",
        "model": "gpt-5.6-sol",
        "version": "codex-cli 0.144.6",
        "runId": "codex-reauthor-PREM-SCI-010-334CA6AB-E6C0-4243-93B0-2BCCCA792178",
        "instructionsDigest": "sha256:00453df4e053230ba35ac35b5a3ca8a194d3068588c5968834b4803be9140c1a"
      }
    }
  ],
  "license": "CC-BY-4.0",
  "files": {
    "assessment": "assessment.json",
    "references": "references.json",
    "claims": "claims.json",
    "glossary": "glossary.json",
    "attribution": "ATTRIBUTION.md"
  },
  "sourceConfidence": "medium-high",
  "aiAssistance": {
    "used": true,
    "disclosure": "VSBDev (github:VSBDev) is accountable for this clinical-framing revision. Material authoring assistance used system RUNTIME-STAMPED, provider RUNTIME-STAMPED, model RUNTIME-STAMPED, version RUNTIME-STAMPED, in isolated run codex-reauthor-PREM-SCI-010-334CA6AB-E6C0-4243-93B0-2BCCCA792178. The instructions digest covers the exact discloseable UTF-8 lesson-revision task payload supplied by the user, including its terminal newline; it excludes hidden provider and system instructions."
  },
  "thirdPartyAssets": []
}
